{"authority":"nxb-v11-endurance-cycle-summary-v1","candidate":{"sha":"aaaaaaaaaaaaaaaaaaaaaaaaaaaaaaaaaaaaaaaa","tree_sha":"bbbbbbbbbbbbbbbbbbbbbbbbbbbbbbbbbbbbbbbb"},"cell_id":"win11-25h2-x64-ps76-py312-adk26100","cycle_count":1,"cycles":[{"candidate_sha":"aaaaaaaaaaaaaaaaaaaaaaaaaaaaaaaaaaaaaaaa","candidate_tree_sha":"bbbbbbbbbbbbbbbbbbbbbbbbbbbbbbbbbbbbbbbb","cell_id":"win11-25h2-x64-ps76-py312-adk26100","elapsed_seconds":3600,"fingerprint_after_sha256":"cccccccccccccccccccccccccccccccccccccccccccccccccccccccccccccccc","fingerprint_before_sha256":"cccccccccccccccccccccccccccccccccccccccccccccccccccccccccccccccc","finished_utc":"2026-10-06T01:00:00Z","index":1,"observability":{"disk_bytes":536870912,"memory_wpr_trigger_count":1,"trace_accounting_closed":true,"trace_lost_events":0,"trace_post_seconds":30,"trace_pre_seconds":30,"trace_ring_bytes":67108864,"trace_session_seconds":300},"part3":{"accounting_closed":true,"high_watermark":6,"low_watermark":2,"max_frame_bytes_observed":16384,"max_queue_depth_observed":8,"max_session_seconds_observed":300,"queue_overflow":0,"reconnect_attempts":3,"spool_byte_peak":262144,"spool_record_peak":64,"synthetic_event_count":24},"part4":{"crash_detected":true,"emergency_recovery_closed":true,"final_resume_closed":true,"graceful_recovery_closed":true,"max_attempts_observed":3,"max_ticks_observed":256,"ready_queue_peak":24,"task_count":24,"tasks_completed":24},"raw_evidence_sha256":{"observability":"3333333333333333333333333333333333333333333333333333333333333333","part3":"1111111111111111111111111111111111111111111111111111111111111111","part4":"2222222222222222222222222222222222222222222222222222222222222222","recovery":"4444444444444444444444444444444444444444444444444444444444444444"},"started_utc":"2026-10-06T00:00:00Z"}],"endurance_tier":"1h","fingerprint_sha256":"cccccccccccccccccccccccccccccccccccccccccccccccccccccccccccccccc","intent_sha256":"eeeeeeeeeeeeeeeeeeeeeeeeeeeeeeeeeeeeeeeeeeeeeeeeeeeeeeeeeeeeeeee","physical_compatibility_claimed":false,"policy_sha256":"dddddddddddddddddddddddddddddddddddddddddddddddddddddddddddddddd","production_boundary":{"merge_mutation":false,"private_key_used":false,"release_mutation":false,"repository_protection_mutated":false,"tag_mutation":false},"raw_payloads_embedded":false,"repository":"Naveax/nxb-integrity-research-lab","review":{"entry_count":6},"schema_version":1,"status":"synthetic_closed_unadmitted","support_class":"primary"}